{
  "id": "chatgpt",
  "name": "ChatGPT",
  "slug": "chatgpt",
  "shortDescription": "General-purpose conversational AI assistant developed by OpenAI with reasoning, voice, and multimodal capabilities.",
  "description": "ChatGPT is an AI-powered conversational platform built on OpenAI's GPT-4o and o-series reasoning models. It assists users with writing, brainstorming, coding, data analysis, mathematics, and multimodal visual analysis. Available across web and mobile platforms with both free and subscription tiers.",
  "categories": [
    "chatbots-assistants",
    "writing-content",
    "coding-development"
  ],
  "subcategories": [
    "general-purpose",
    "code-assistants"
  ],
  "tags": [
    "chat",
    "assistant",
    "reasoning",
    "coding",
    "writing",
    "multimodal"
  ],
  "websiteUrl": "https://chatgpt.com",
  "pricing": {
    "model": "freemium",
    "details": "Free tier with GPT-4o mini; Plus subscription ($20/mo) includes priority access to reasoning models and advanced voice mode.",
    "lastVerifiedAt": "2026-10-15"
  },
  "platforms": [
    "web",
    "android",
    "ios",
    "macos",
    "windows"
  ],
  "isOpenSource": false,
  "sourceCodeUrl": null,
  "isFeatured": true,
  "status": "published",
  "features": [
    "Multimodal input and output (text, images, files, voice)",
    "Advanced reasoning models (o1, o3) for complex math and science",
    "Web search with live citations",
    "Custom GPTs creation and store ecosystem",
    "Code Interpreter and interactive Python execution environment"
  ],
  "useCases": [
    "Brainstorming and research synthesis",
    "Drafting essays, emails, and reports",
    "Analyzing spreadsheets and generating charts",
    "Explaining complex technical concepts"
  ],
  "alternatives": [
    "claude",
    "deepseek",
    "perplexity"
  ],
  "relatedTools": [
    "github-copilot",
    "notion-ai"
  ],
  "languageSupport": [
    "multilingual",
    "English",
    "Spanish",
    "French",
    "German",
    "Japanese",
    "Chinese",
    "Hindi"
  ],
  "accountRequired": true,
  "limitations": [
    "Rate limits apply on free and paid tiers for top-tier reasoning models",
    "Potential hallucinations on niche domain facts"
  ],
  "lastVerifiedAt": "2026-10-15",
  "sourceReferences": [
    "https://openai.com/chatgpt"
  ],
  "createdAt": "2023-01-15",
  "updatedAt": "2026-10-15",
  "seo": {
    "title": "ChatGPT — Conversational AI & Reasoning Assistant by OpenAI",
    "description": "Discover ChatGPT features, pricing, platforms, and alternatives in the AI Tools Directory."
  }
}
